{
  "schema_version": 1,
  "request_id": "req_0001",
  "analysis_id": "t_test.independent",
  "dataset_id": "ds_7f3a",
  "snapshot_id": "snap_9c21e4",
  "variables": {
    "outcome": [
      "math_attitude"
    ],
    "group": [
      "condition"
    ]
  },
  "subset": [
    {
      "variable": "Time",
      "op": "in",
      "values": [
        "Post"
      ]
    }
  ],
  "options": {
    "welch": true
  },
  "corrections": [],
  "alpha": 0.05,
  "tails": "two_sided",
  "ci_level": 0.95
}
